{
  "protocol_version": "agent.v1",
  "catalog_version": "agent_catalog.v1",
  "generated_at": "2026-06-28T09:12:31Z",
  "active_domains": ["chat"],
  "agents": [
    {
      "protocol_version": "agent.v1",
      "id": "ai_chat",
      "name": "AI Chat",
      "description": "Default conversational agent for the TUI.",
      "version": "0.1.0",
      "schedule": {
        "type": "manual"
      },
      "capabilities": ["chat_agent", "natural_language"],
      "metadata": {
        "domain": "chat",
        "agent_type": "chat",
        "surface": "agent_tui",
        "dart_type": "AiChatAgent",
        "prompt_id": "ai_chat_prompt",
        "prompt_version": "ai_chat.prompt.v1",
        "model_family": "anthropic",
        "provider": "anthropic",
        "model": "stepfun-ai/Step-3.7-Flash",
        "tool_schema_version": "chat.tools.v1"
      }
    }
  ],
  "tools": [
    {
      "name": "propose_fake",
      "description": "Propose fake data",
      "input_schema": {
        "type": "object"
      },
      "risk": "medium",
      "metadata": {
        "access": "propose",
        "requires_confirmation": "one_tap",
        "domain": "finance"
      }
    }
  ],
  "proposal_kinds": [
    {
      "kind": "fake",
      "tool_name": "propose_fake",
      "risk": "medium",
      "approval_policy": "manual",
      "required_approval_level": "single_user",
      "required_approver_count": 1,
      "policy_id": "finance.proposal.default",
      "policy_version": "2026-06-28",
      "expires_after_seconds": 86400
    }
  ],
  "prompt_blocks": [
    {
      "index": 0,
      "text": "You are the default interactive agent in the Agent Runtime TUI. Answer in the user's language, keep responses concise and practical, ask clarifying questions only when required, and use available tools when they materially improve the answer. When a tool or approval is needed, explain the action and wait for the runtime approval flow."
    }
  ]
}
